{
  "$schema": "https://json-schema.org/draft/2020-12/schema",
  "$id": "https://fleet.harnessx.net/schemas/manifest.schema.json",
  "title": "Fleet manifest (environment contract)",
  "description": "Repo-owned declaration of everything a sandbox needs to be the developer's environment, elsewhere. Canonical path: .fleet/manifest.json (root-level fleet.json accepted as fallback; both present = dispatch error).",
  "type": "object",
  "required": ["version", "setup", "workspace", "harness", "gates"],
  "additionalProperties": false,
  "properties": {
    "version": { "const": 1 },
    "setup": {
      "description": "How the job image is built. Preferred: point at the repo's devcontainer. Fallback: image/dockerfile + setup script.",
      "type": "object",
      "additionalProperties": false,
      "properties": {
        "devcontainer": { "type": "string", "description": "Path to devcontainer.json (image/build/postCreateCommand subset, built via @devcontainers/cli)." },
        "image": { "type": "string", "description": "Base image (fallback form)." },
        "dockerfile": { "type": "string", "description": "Dockerfile path (fallback form, mutually exclusive with image)." },
        "script": { "type": "string", "description": "Setup script: deps, build, seed. Runs with unrestricted egress; the allowlist clamps only the harness run." }
      },
      "oneOf": [
        { "required": ["devcontainer"], "not": { "anyOf": [{ "required": ["image"] }, { "required": ["dockerfile"] }] } },
        { "required": ["image"], "not": { "anyOf": [{ "required": ["devcontainer"] }, { "required": ["dockerfile"] }] } },
        { "required": ["dockerfile"], "not": { "anyOf": [{ "required": ["devcontainer"] }, { "required": ["image"] }] } }
      ]
    },
    "workspace": {
      "type": "object",
      "required": ["repo", "strategy"],
      "additionalProperties": false,
      "properties": {
        "repo": { "type": "string", "description": "Git remote URL, or the sentinel \"origin\": resolve the URL from the workspace's origin remote at dispatch. Prefer the sentinel — it keeps the manifest portable across forks and mirrors and keeps org-specific URLs out of the file." },
        "strategy": {
          "enum": ["branch-per-job"],
          "description": "branch-per-job: branch fleet/<ticket>-<job-id>, based on the remote default branch at dispatch, pushed at creation so retain-for-evidence holds even if the container dies."
        },
        "sync": {
          "type": "array",
          "items": { "type": "string" },
          "description": "Gitignored runtime config shipped from the operator's CLI to the daemon at dispatch. May carry secret values (laptop trust class) until a broker lints .env* out and moves values to env.vars. Injected env vars win over file-loaded values where the process environment is consulted."
        }
      }
    },
    "env": {
      "type": "object",
      "additionalProperties": false,
      "properties": {
        "vars": {
          "type": "array",
          "items": { "type": "string", "pattern": "^[A-Z][A-Z0-9_]*$" },
          "description": "Names only — values injected at task start, never stored in the manifest. Lookup: exact name in the dispatching shell's environment; missing value fails dispatch loudly."
        }
      }
    },
    "services": {
      "type": "array",
      "items": {
        "type": "object",
        "required": ["kind"],
        "additionalProperties": false,
        "properties": {
          "kind": { "enum": ["github", "jira", "confluence", "mcp"] },
          "name": { "type": "string" },
          "scope": { "type": "array", "items": { "type": "string" } },
          "permissions": { "type": "array", "items": { "type": "string" } },
          "config": { "type": "string", "description": "For mcp: <path>#<key> where key is the entry under mcpServers in the referenced file. Creds ride the synced config (broker-exempt) until a broker templates the config and injects short-lived tokens." }
        }
      }
    },
    "harness": {
      "type": "object",
      "required": ["cli", "commands"],
      "additionalProperties": false,
      "properties": {
        "cli": { "enum": ["claude-code", "codex", "opencode"], "description": "Runner adapter: claude-code; others when an adopter needs them." },
        "cli_version": { "type": "string", "description": "Pin the CLI version in the image — format churn arrives only when the repo chooses to upgrade." },
        "env": {
          "type": "object",
          "additionalProperties": { "type": "string" },
          "description": "Harness-runtime env flags baked into the task (e.g. CLAUDE_CODE_EXPERIMENTAL_AGENT_TEAMS=1). Not secrets."
        },
        "agents": { "type": "string", "description": "Path to the agent definitions directory (e.g. .claude/agents). Declared for dispatch-time validation: every agent file must match a registry entry by frontmatter name or dispatch refuses." },
        "commands": {
          "type": "array",
          "minItems": 1,
          "items": {
            "type": "object",
            "required": ["path", "critic"],
            "additionalProperties": false,
            "properties": {
              "path": { "type": "string" },
              "critic": { "type": "string", "description": "Named critic agent — the manifest lint enforcing the no-run-without-a-critic rule." }
            }
          }
        }
      }
    },
    "gates": {
      "type": "object",
      "required": ["pickup"],
      "additionalProperties": false,
      "properties": {
        "pickup": { "type": "string", "description": "REQUIRED command; must exit 0 or the job aborts before model spend. The gate script owns its own force-fetch; the runner treats every nonzero exit identically." },
        "default_finish": {
          "$ref": "work-order.schema.json#/$defs/targetableRung",
          "default": "merge-ready",
          "description": "Repo-default target rung when the work order does not name one."
        }
      }
    },
    "limits": {
      "type": "object",
      "additionalProperties": false,
      "properties": {
        "wall_clock": { "type": "string", "pattern": "^[1-9][0-9]*(s|m|h)$", "description": "Agent-runtime budget; pauses while blocked. Expiry: SIGTERM + grace, settle with partial outcome, state cancelled, branch retained. Supports s/m/h units; zero is not a value (an instant death sentence is a typo, not a budget). No default — absent means unbounded, backstopped by idle." },
        "idle": { "type": "string", "pattern": "^[1-9][0-9]*(s|m|h)$", "description": "Liveness check, not a cost bound: no harness output for this long (blocked time excluded) → SIGTERM + grace, partial work pushed, settle with the idle duration, state cancelled reason stall. Supports s/m/h units; zero is not a value — stall detection cannot be switched off, only widened. Must exceed the pickup gate's runtime: the daemon's mirror of this limit measures silence on the event stream, which the gate does not feed. Absent defaults to 20m — the default lives in src/shared/time.ts (idleLimitMs), the one source of truth (#134)." },
        "block_hot": { "type": "string", "pattern": "^[0-9]+(m|h)$", "description": "How long a blocked container stays hot before parking (WIP committed, task exits). Absent defaults to 30m — the default lives in src/shared/time.ts (blockHotLimitMs), the one source of truth (#134)." },
        "decision_timeout": { "type": "string", "pattern": "^[0-9]+(m|h)$", "description": "Unanswered past this → job marked stale; stays parked; never auto-answered. Absent defaults to 24h — the default lives in src/shared/time.ts (decisionTimeoutMs), the one source of truth (#134)." },
        "model_spend": { "type": "string", "description": "OPEN — not enforced; the structural bounds apply meanwhile (scale to zero, the capacity cap, wall_clock). Per-job metering arrives with fleet-native cost reporting." },
        "egress": {
          "type": "array",
          "items": { "type": "string" },
          "description": "Hostname allowlist, applies after setup completes. Declared today, unenforced; once enforced, an absent field denies everything except hosts implied by services and the model API. TBD = DENY."
        },
        "resources": {
          "type": "object",
          "additionalProperties": false,
          "description": "Resource requirements for the sandbox container. ECS: injected as task-level cpu/memory overrides on run-task. Docker: --cpus/--memory flags. Process: noted but not enforced. A request that exceeds every offered capacity tier is rejected at dispatch with the exact numbers.",
          "properties": {
            "cpu": { "type": "integer", "minimum": 1, "description": "CPU in ECS units (256 = 0.25 vCPU, 1024 = 1 vCPU)." },
            "memory": { "type": "integer", "minimum": 1, "description": "Memory limit in MiB." },
            "disk": { "type": "integer", "minimum": 1, "description": "Ephemeral disk in GiB (advisory; not all providers enforce it)." }
          }
        }
      }
    }
  }
}
